question,answer
"Какой комбо ловит камеры дальше всех","Дальность обнаружения камер комбо-устройством зависит от нескольких факторов, в первую очередь от типа используемой радарной антенны и наличия усилителя слабых сигналов (LNA): рупорная антенна обычно обеспечивает большую дальность обнаружения по сравнению с патч-антенной. Наличие LNA (Low Noise Amplifier - усилитель слабых сигналов) значительно увеличивает чувствительность и, соответственно, дальность приёма сигналов от полицейских радаров, как для рупорных, так и для патч-антенн. При выборе обращайте внимание на эти характеристики в описании модели. Устройства с рупорной антенной и/или LNA будут иметь преимущество в дальности обнаружения."
"Как обновится по WiFi","Для обновления прошивки и/или баз камер устройства Fujida по Wi-Fi через мобильное приложение, следуйте этим шагам: Установите приложение: скачайте и установите приложение Fujida (или Fujida Pro, в зависимости от модели) на ваш смартфон. Для iOS – из App Store, для Android – из Google Play. Включите Wi-Fi на устройстве Fujida: активируйте Wi-Fi в меню вашего видеорегистратора/комбо-устройства. Подключите смартфон к Wi-Fi сети устройства: на телефоне в настройках Wi-Fi найдите сеть, созданную вашим устройством Fujida (название сети обычно содержит Fujida или модель устройства). Пароль по умолчанию чаще всего 12345678. Откройте приложение Fujida на смартфоне: при первом запуске дайте все необходимые разрешения приложению. Важно: выберите в приложении именно вашу модель устройства. Если модель не видна сразу, проверьте вкладки типа Гибриды, GPS-информаторы, Регистраторы. Загрузка и установка обновления: приложение автоматически проверяет наличие обновлений для подключенного устройства. Если обновление доступно, вам будет предложено его загрузить. Для загрузки обновления на телефон может потребоваться мобильный интернет (3G/4G/LTE). После загрузки обновления на телефон, запустите процесс установки на устройство Fujida через приложение. Устройство может перезагрузиться во время обновления. Не отключайте питание. Особенности для некоторых ОС: Android – иногда для стабильного подключения к Wi-Fi устройства требуется временно отключить мобильную передачу данных на телефоне. iOS – если возникают проблемы с подключением или передачей данных (например, приложение требует отключить мобильный интернет), убедитесь, что для приложения Fujida в настройках iOS разрешен доступ к Локальной сети."
"Устройство не включается, что делать","Если ваше устройство Fujida не включается, попробуйте следующие шаги для диагностики: Проверьте подключение и питание: используйте только оригинальный адаптер питания со шнуром, который шел в комплекте с устройством, и подключите его к прикуривателю автомобиля. Неоригинальные или поврежденные кабели/адаптеры могут не обеспечивать достаточного питания. Проверьте, горит ли индикатор на адаптере питания (если он есть). Если не горит, проверьте предохранитель в адаптере и сам прикуриватель. Попробуйте включить без карты памяти: извлеките карту памяти из устройства и попробуйте его включить. Если устройство включается без карты, проблема может быть в карте. Проверьте карту памяти: проверить карту памяти на скорость и работоспособность можно с помощью программы HD_Speed (https://www.fujida.su/guarantee/microSD-test.php?clear_cache=Y). Видеоинструкция: https://vkvideo.ru/video-174258496_456239177. Если карта неисправна, замените ее. Попробуйте обновить прошивку (если есть подозрение на программный сбой): перейдите на сайт https://update.fujida.su/services/, скачайте актуальную прошивку для вашей модели, извлеките файлы, отформатируйте карту памяти (FAT32, кластер 32КБ), скопируйте файлы прошивки в корень карты памяти, вставьте карту в выключенный видеорегистратор, подключите питание через оригинальный кабель — обновление начнется автоматически. Если ничего не помогло, вероятно, неисправность аппаратная. Обратитесь в сервисный центр Fujida."
"Регистратор перезагружается что можно сделать","Если ваш видеорегистратор Fujida постоянно перезагружается, выполните следующие проверки: Проверьте питание: убедитесь, что используете оригинальный адаптер питания со шнуром, идущий в комплекте. Он обеспечивает необходимое напряжение и ток для стабильной работы. Использование неоригинальных аксессуаров – частая причина перезагрузок. При запуске двигателя напряжение в бортовой сети автомобиля может кратковременно падать. Большинство регистраторов имеют задержку включения, но если аккумулятор слаб, падение может быть слишком сильным. Проверьте карту памяти: неисправная, несовместимая (например, очень большого объема) или медленная карта памяти (ниже 10 класса скорости) – одна из самых частых причин перезагрузок. Попробуйте включить устройство без карты памяти. Если перезагрузки прекратились, проблема в карте. Проведите проверку карты с помощью программы HD_Speed (https://www.fujida.su/guarantee/microSD-test.php?clear_cache=Y). Видеоинструкция: https://vkvideo.ru/video-174258496_456239177. Если скорость записи ниже 10 МБ/с, карту необходимо заменить. Обновите прошивку: скачайте актуальную прошивку на сайте https://update.fujida.su/services/ и выполните обновление. Сбросьте настройки до заводских. Если проблема сохраняется, обратитесь в сервисный центр Fujida."
"Как обновить устройство через карту памяти","Чтобы обновить прошивку и/или базу камер на устройстве Fujida с помощью компьютера и карты памяти, выполните шаги: 1) Скачайте файлы на https://update.fujida.su/services/, выберите модель и скачайте актуальную прошивку. 2) Извлеките файлы из архива (.zip, .rar). 3) Подготовьте карту памяти microSD: карты 64 ГБ и более форматируйте в устройстве через меню; карты до 32 ГБ можно форматировать на ПК (FAT32, кластер 32 КБ). 4) Скопируйте файлы прошивки (обычно один или несколько .bin) в корень карты памяти. 5) Установите обновление: вставьте карту в выключенный регистратор, подключите питание через оригинальный кабель в авто. Обновление начинается автоматически, на экране отображается статус. Не отключайте питание! 6) Завершение: после обновления устройство перезагрузится, файлы с карты могут удалиться автоматически. 7) Проверьте в меню версию прошивки. Видеоинструкция: https://vk.com/video/@fujida_rus?z=video-174258496_456239174%2Fclub174258496"
"Не говорит о камерах / Почему не предупреждает о приближении к камерам?","Если ваше устройство Fujida не предупреждает о камерах, причины могут быть следующими: Недостаточное питание: убедитесь, что устройство подключено с помощью оригинального шнура питания от прикуривателя. Недостаток питания может влиять на корректную работу GPS и радарной части. Проблемы с картой памяти: неисправная или некачественная карта памяти может вызывать сбои в работе устройства, включая GPS-оповещения. Проведите проверку карты памяти программой HD_Speed (https://www.fujida.su/guarantee/microSD-test.php?clear_cache=Y). Видеоинструкция: https://vk.com/video/@fujida_rus?z=video-174258496_456239177. Блокировка GPS-сигнала: в некоторых регионах (особенно стратегически важных, например, Москва и МО) возможно подавление GPS-сигналов системами РЭБ. Проверьте работу GPS, выехав за город. Если иконка спутника станет активной или начнет отображаться скорость, GPS-соединение установлено. Устаревшая прошивка или база камер: убедитесь, что установлена актуальная версия прошивки и базы камер. Если проблема сохраняется, сообщите службе поддержки модель и текущую версию."
"Как предложить исправления/добавления в базу камер?","Для внесения исправлений или добавления новой камеры в базу Fujida предоставьте службе поддержки: фото камеры; точные GPS-координаты её местоположения (например, 56.16419/48.28773); либо постановление о штрафе с этого места. Также опишите характер исправления (неверный тип камеры, направление, ошибочное предупреждение и т.д.)."
"Не подключается по Wi-Fi к приложению (iOS) / Не могу обновить по Wi-Fi.","Если возникают проблемы с подключением устройства Fujida к iPhone по Wi-Fi: используйте актуальное приложение Fujida.Pro (скачать из App Store). Правильный выбор модели: выберите именно свою модель устройства. Доступ к локальной сети: проверьте, предоставлен ли доступ приложению (Настройки -> Конфиденциальность и безопасность -> Локальная сеть -> Fujida.Pro -> включить). Также дайте разрешения на уведомления. VPN: отключите на время подключения. Перезагрузка и переподключение: перезагрузите смартфон и регистратор, забудьте сеть Wi-Fi и подключитесь заново. Карта памяти: убедитесь, что установлена исправная карта."
"Как обновить / скачать видео по Wi-Fi (Android)?","Для работы с устройством Fujida через Wi-Fi на Android: используйте приложение Fujida.Pro (скачать из Google Play или установить APK, предоставленный поддержкой). Для установки APK откройте его на телефоне и разрешите установку из неизвестных источников. Правильный выбор модели: в приложении выберите именно вашу модель устройства. Подключение: включите Wi-Fi на видеорегистраторе, подключитесь к его сети на телефоне, затем откройте приложение."
"Проблемы с подключением/обновлением по Wi-Fi на iOS (Fujida Zoom Smart S и другие модели). Не видит файлы, предлагает обновить актуальную базу.","Если возникают сложности с подключением Fujida к iPhone: проверьте карту памяти — она должна быть исправна. Отформатируйте карту через меню регистратора. Проверьте карту на ПК программой HD_Speed (https://www.fujida.su/guarantee/microSD-test.php?clear_cache=Y). Видеоинструкция: https://vk.com/video/@fujida_rus?z=video-174258496_456239177. Приложение и разрешения: используйте Fujida.Pro из App Store, обязательно предоставьте доступ к «Локальной сети» (Настройки -> Fujida.Pro -> Локальная сеть). Убедитесь, что выбрана правильная модель устройства. Процесс обновления: если база уже актуальна, приложение загрузит базу на телефон, но не установит на устройство — это нормально. Видеоинструкция: https://vk.com/video/@fujida_rus?z=video-174258496_456239175. Дополнительно: отключите VPN, перезагрузите устройства, забудьте сеть и подключитесь заново."
"Проблемы с обновлением прошивки/базы камер с ПК (версия базы отображается как 00000000, обновление не запускается).","Если после обновления с ПК версия базы отображается как 00000000: проверьте питание (используйте оригинальный кабель). Проверьте правильность процесса: скачайте актуальный файл прошивки на https://update.fujida.su/services/, извлеките файлы (.bin). Форматирование карты: карты 64 ГБ+ форматируйте в регистраторе, карты до 32 ГБ — на ПК (FAT32, кластер 32 КБ). Копирование файлов: перенесите файлы в корень карты. Установка: вставьте карту в выключенный регистратор, подключите питание оригинальным кабелем в авто. На экране должен появиться статус обновления. После завершения устройство перезагрузится. Проверьте версию ПО. Видеоинструкция: https://youtu.be/5uJtrqqct6c (ссылка может быть неактуальна, проверяйте на официальных ресурсах Fujida)."
"Не отображается скорость и нет предупреждений о камерах (проблемы с подключением к спутникам GPS).","Если устройство не показывает скорость и не предупреждает о камерах, это указывает на отсутствие соединения со спутниками GPS. Возможные причины: 1) Питание и карта памяти: убедитесь, что используется оригинальный шнур питания и исправная карта памяти. 2) Атермальное остекление или подогрев лобового стекла: такие стекла могут блокировать GPS-сигнал. Разместите устройство в технической зоне лобового стекла (обычно вокруг зеркала заднего вида). 3) Региональные помехи GPS: в некоторых регионах (Москва, МО и др.) возможно подавление GPS системами РЭБ. Для проверки выезжайте за город. Если иконка спутника станет активной или начнет отображаться скорость, GPS-модуль исправен."
"Как проверить карту памяти / Проблемы с программой проверки карты памяти (HD_Speed).","Для проверки карты памяти: 1) Скачайте программу HD_Speed: https://www.fujida.su/guarantee/microSD-test.php?clear_cache=Y. 2) Запустите программу: в поле «Накопитель» выберите вашу карту, в режиме проверки выберите «Запись» (Write), нажмите «Старт». 3) Интерпретация: график должен быть ровным. Скорость записи должна быть не ниже 10 МБ/с. Видеоинструкция: https://vk.com/video/@fujida_rus?z=video-174258496_456239177. Если карта исправна, но проблемы сохраняются — обновите прошивку и базу камер (файлы доступны на https://update.fujida.su/services/)."
"Видеорегистратор самопроизвольно перезагружается (например, Fujida Zoom Hit Max).","Если видеорегистратор перезагружается: 1) Проверьте питание — используйте оригинальный шнур. 2) Проверьте карту памяти: попробуйте включить устройство без карты. Если перезагрузки прекратились — проблема в карте. Проверьте карту через HD_Speed (https://www.fujida.su/guarantee/microSD-test.php?clear_cache=Y), видеоинструкция: https://vk.com/video/@fujida_rus?z=video-174258496_456239177. Если скорость записи низкая, замените карту. 3) Проверьте устройство в другом авто. 4) Установите задержку включения (10–30 секунд), чтобы избежать просадки напряжения. 5) Если не помогло — обратитесь в сервисный центр (заполните бланк: https://fujida.su/catalog/blank_neispravnost.doc, приложите чек, серийный номер и свяжитесь с поддержкой по 8-800-500-31-16)."
"Ошибка записи на карте памяти / Проблемы с форматированием (например, на Fujida Okko).","Если появляется «Ошибка записи» даже на фирменной карте: 1) Для моделей вроде Okko выполните спец. форматирование: отформатируйте карту через меню, снимите устройство с магнитного крепления, выключите и снова включите. Повторите при необходимости. 2) Общие рекомендации: карта должна соответствовать классу скорости и объему; проверьте ее на ПК через HD_Speed. 3) Если есть проблемы с Wi-Fi подключением (например, на iPhone): используйте приложение Fujida.Pro, выберите правильную модель, предоставьте приложению доступ к «Локальной сети»."
"Нечитаемые символы в названии сети вместо fujida, не подключается по wifi, пишет неверный пароль.","Решение — обновите устройство через карту памяти и ПК: 1) Перейдите на https://update.fujida.su/services/. 2) Скачайте файл «Актуальная прошивка и база камер». 3) Извлеките файлы. 4) Отформатируйте карту microSD на устройстве (или на ПК FAT32, кластер 32КБ, если карта ≤32ГБ). 5) Скопируйте файлы в корень карты. 6) Вставьте карту в выключенный регистратор. 7) Подключите питание оригинальным кабелем. 8) На экране появится статус обновления. 9) После завершения устройство перезагрузится, файлы удалятся автоматически."
"Модель Zoom Okko, на экране отображаются знаки ограничения скорости.","Переустановите прошивку: 1) Перейдите на https://fujida.su/catalog/videoregistratory/fujida-zoom-okko/. 2) В разделе «Характеристики» скачайте «Актуальную прошивку». 3) Отформатируйте карту через меню регистратора. 4) Скопируйте файл из архива на карту памяти (в корень). 5) Вставьте карту в выключенный регистратор. 6) Подключите питание. На дисплее загорится синий индикатор. 7) После завершения устройство перезагрузится, файлы удалятся автоматически. 8) Проверьте в меню версию прошивки."
