question,answer
"Также наблюдаются 5 секундные видео записи, что это и как убрать.","Причины: 1) Включен датчик движения. Он работает только в режиме парковки и вызывает нестабильную запись при движении. 2) Неисправная или некачественная карта памяти. Проверьте карту через HD_Speed (https://www.fujida.su/guarantee/microSD-test.php?clear_cache=Y) и отправьте фото графика в поддержку."
"Какой видеоплеер вы рекомендуете для просмотра записей с видеорегистратора с привязкой к GPS?","Фирменного плеера с GPS-треком нет. При просмотре видео будут отображаться координаты. Если нужен GPS-трекер — используйте приложение Fujida.Pro. Скачать можно в Play Market (Android) или App Store (iOS)."
"Что такое режим СМАРТ?","«СМАРТ» — это условное название режима с оптимальными настройками, адаптированными для общего использования как в городе, так и на трассе. Используется сигнатурная технология и интеллектуальное оповещение о камерах. К-диапазон выключен и не функционирует до 50 км/ч, свыше 50 км/ч работает согласно выставленным настройкам. При скорости свыше 110 км/ч дальность обнаружения камер по GPS увеличивается в 2 раза. При скорости свыше 130 км/ч фильтр слабых сигналов отключается."
"Что такое режим ТУРБО?","«ТУРБО» — это условное название режима с максимальной дальностью обнаружения камер и с минимальной фильтрацией, адаптированного для общего использования как в городе, так и на трассе. Используется сигнатурная технология и интеллектуальное оповещение о камерах. Дальность обнаружения камер по GPS увеличена в 2 раза."
"Что такое режим ТИХИЙ?","«ТИХИЙ» — это условное название режима, который работает исключительно как GPS-информер. В этом режиме все сигналы в радарных диапазонах K, Стрелка и Лазер детектируются только на скорости свыше 110 км/ч. Рекомендуется использовать в крупных городах и мегаполисах с высоким уровнем радиофона."
"Что такое Режим?","Режим — набор определённых настроек для устройств, их можно изменять в зависимости от местности. Комбо-устройства с радар-детектором имеют режимы: СМАРТ, ТИХИЙ, ТУРБО. Модели c GPS-информатором: РОССИЯ и СНГ."
"Что такое функция Голос?","Голос — функция голосового оповещения. При необходимости эта функция может быть отключена. Установленное значение по умолчанию: ВКЛ."
"Что такое функция Автоприглушение?","Автоприглушение — автоматически приглушает громкость звука. Громкость звукового оповещения уменьшится на 30 % через 7 секунд после приема. Установленное значение по умолчанию: ВКЛ."
"Что такое функция Сигнатура?","Сигнатура — подпись электронного измерителя скорости. Радар-детектор анализирует принимаемый сигнал, и если он совпадает с сигнатурным образцом, заложенным в устройстве, то радар-детектор предупреждает водителя, показывая конкретный тип радара (КОРДОН, КРИС, СКАТ и т.п). Установленное значение по умолчанию: ВКЛ."
"Что такое X-диапазон?","X-диапазон. Радарные комплексы работают в определенном диапазоне частот, радар-детектор воспринимает сигнал от комплекса и оповещает пользователя о нём. В данный момент в России не используются радарные комплексы с диапазоном X. Установленное значение по умолчанию: ВЫКЛ."
"Что такое K-диапазон?","К-диапазон. Большинство радарных комплексов в России работают в диапазоне K, но сигналы в этом диапазоне могут исходить также от сенсорных дверей, линий электропередач и т.п. При условии, если в вашем регионе не установлен комплекс «Арена» (который работает во всем диапазоне K и не имеет собственной сигнатуры) и комбо-устройство обладает сигнатурной технологией, то вы можете отключить K-диапазон, таким образом устройство будет оповещать о камере по сигнатуре и будут исключены различные помехи. При выборе «Тихий» звук оповещения постоянно работает с приглушением. Установленное значение по умолчанию: ВКЛ."
"Что такое Стрелка?","Стрелка — детектирование радарным модулем Стрелки. Радарный комплекс «Стрелка» работает в диапазоне K, но сигнал этого комплекса отличается, поэтому «Стрелка» детектируется как отдельный тип сигнала. Установленное значение по умолчанию: ВКЛ."
"Что такое Лазер?","Лазер — детектирование лазерным модулем. Установленное значение по умолчанию: ВКЛ."
"Что такое Фильтр скорости?","Фильтр скорости. Комбо-устройство не подает звуковых сигналов в зависимости от текущей скорости автомобиля, а только отображает информацию о камере на дисплее. Например, если фильтр скорости равен 60 км/ч, то при движении со скоростью 59 км/ч видеорегистратор не будет издавать никаких звуковых оповещений. Для того чтобы устройство всегда подавало звуковые оповещения о камере, вне зависимости от текущей скорости, установите значение «ВЫКЛ». Установленное значение по умолчанию: 60 км/ч."
"Что такое Действие фильтра скорости?","Действие фильтра скорости. Возможность отключения звуковых/голосовых оповещений до достижения установленного значения фильтра скорости не только сигналов в радарных диапазонах и сигналов лазера, но и оповещений о стационарных камерах по базе координат GPS. Рекомендуется использовать только параметр РАДАР. Для отключения звуковых/голосовых оповещений до достижения установленного значения фильтра скорости по радиомодулю и модулю GPS установите значение РАДАР и GPS. Установленное значение по умолчанию: РАДАР."
"Что такое Допустимое превышение скорости?","Допустимое превышение скорости. Корректировка установленного ограничения скорости в базе камер. При движении выше максимально разрешенной скорости на участке на 20 км/ч (или 10 км/ч) поступит звуковое оповещение «Снижайте скорость!». Вы можете установить следующие значения допустимого превышения: 0-5-10-15-18-20-30 км/ч. Установленное значение по умолчанию: 20 км/ч."
"Что такое Фильтр слабых сигналов?","Фильтр слабых сигналов. Функция, которая позволяет уменьшить ложные срабатывания. Например, если значение фильтра установлено на «3», то радар-детектор не будет подавать звуковых оповещений, пока сила обнаруженного сигнала будет менее 3. Установленное значение по умолчанию: 2."
"Что такое Обнаружение GPS камер?","Обнаружение GPS камер. Функция, позволяющая настроить дальность обнаружения камер по базе GPS. «Мин» — минимальная дальность обнаружения. «Авто» — дальность обнаружения увеличивается в 2 раза после 110 км/ч. «Макс» — дальность обнаружения увеличена в 2 раза. Например, если при значении «Мин» устройство оповестит о камере за 400 метров, то при значении «Макс» оповещение о той же камере поступит за 800 метров. Установленное значение по умолчанию: Авто."
"Что такое «Тихий» режим радара?","«Тихий» режим радара. Функция, позволяющая отключить оповещения о сигналах в радарных диапазонах и сигналах лазера при движении со скоростью ниже выбранной. Например, если «тихий» режим радара равен 10 км/ч, то при текущей скорости от 0 до 9 км/ч оповещения по радар-детектору будут отсутствовать. При текущей скорости 10 км/ч и более устройство оповестит об обнаруженном сигнале, его силе и диапазоне. Установленное значение по умолчанию: 10 км/ч."
"Что такое «Cнижайте скорость!»?","«Cнижайте скорость!». Возможность отключения голосового предупреждения «Снижайте скорость!» в случае превышения максимально допустимой скорости перед стационарными камерами из базы GPS. Установленное значение по умолчанию: ВКЛ."
"Что такое «Моя максимальная скорость»?","Моя максимальная скорость. Пользователь самостоятельно может выбрать скоростной лимит, при превышении которого поступит уведомление «Снижайте скорость!». Например, если значение функции установлено на 80 км/ч, то при движении со скоростью 81 км/ч поступит голосовое оповещение о том, что необходимо снизить скорость до установленного значения (80 км/ч). Установленное значение по умолчанию: ВЫКЛ."
"Что такое «Платон»?","Платон. Камера «Платон» — это камера фото- и видеофиксации, установленная в рамках системы взимания платы с большегрузов. Она предназначена для автотранспорта весом свыше 12 тонн. Если ваш автомобиль не является большегрузом, то вы можете отключить оповещение о данном типе камер. Установленное значение по умолчанию: ВКЛ."
"Что такое «Контроль автобусной полосы и контроль светофоров»?","Контроль автобусной полосы и контроль светофоров. Камеры контроля светофоров и автобусной полосы также могут измерять превышение скоростного режима, поэтому водитель может по собственному усмотрению включить или выключить обнаружение данного типа камер в GPS-базе. Если данные камеры не направлены на измерение превышения скоростного режима, а только на контроль автобусной полосы и светофоров, то устройство о них оповещать не будет. Установленное значение по умолчанию: ВКЛ."
"Что такое «Муляж камеры»?","Муляж камеры. Оборудование, копирующее дизайн камер, не имеющее возможности фиксации нарушений. Установленное значение по умолчанию: ВКЛ."
"Что такое «Мобильная засада»?","Оповещение о возможных точках нахождения мобильных треног (лазерных и маломощных радаров) согласно базе GPS. Установленное значение по умолчанию: ВКЛ."
"Что такое «База камер»?","Возможность включения и выключения оповещения устройства по базе камер GPS. При выключении «Базы камер» оповещения о камерах будут происходить только по радар-детектору. Установленное значение по умолчанию: ВКЛ."
"Что такое «Контроль средней скорости»?","Контроль средней скорости. Метод измерения скорости транспортного средства на участке дороги с помощью двух синхронизированных камер фотовидеофиксации, установленных в начале и в конце участка контроля. С 2021 года данный метод измерения был признан недействительным. В случае отмены решения пользователь может активировать оповещение об этом типе камер через меню устройства. Установленное значение по умолчанию: ВКЛ."
"Что такое звук для диапазонов «X», «K», «Стрелка», «Лазер»?","Пользователь может присвоить каждому диапазону звуковое оповещение от 1 до 9, которое будет появляться при обнаружении сигнала радар-детектором. Установленное значение по умолчанию на все диапазоны: 3."
"Что такое оповещение «База камер устарела!»?","Если база камер не обновлялась более 60 дней, устройство напомнит о необходимости обновления соответствующим уведомлением на экране и голосовым оповещением. Установленное значение по умолчанию: ВЫКЛ."
"Что такое «Калибровка скорости»?","Показатели спидометра автомобиля фактически отличаются от реальной скорости движения. Причём у различных автопроизводителей коррекционное значение отличается. Если показание скорости устройства отличается от показания спидометра автомобиля, то можно установить параметр корректировки от GPS +0% до GPS +7%. За основу принята скорость, рассчитанная по GPS. Например, GPS +7% означает, что текущая скорость GPS увеличена на 7%. Установленное значение по умолчанию: GPS +3%."
"Что такое «Куранты»?","Голосовое оповещение о каждом полном часе в фоновом режиме. Например: «Текущее время семнадцать часов». Установленное значение по умолчанию: ВКЛ."
"Что такое «Сбросить настройки РД»?","Функция, позволяющая сбросить все настройки радар-детектора до заводских (по умолчанию). Рекомендуется активировать при некорректной работе устройства."
"Что такое «Версия прошивки»?","Указана установленная версия прошивки антенны радар-детектора. Если прошивка стабильная, то её версия может не меняться в течение нескольких месяцев."
"Что такое «Версия базы камер»?","Указана установленная версия базы камер на устройстве. Обновление базы камер достаточно проводить 1 раз в месяц."
"Что такое «WiFi»?","Активируйте WiFi для соединения устройства со смартфоном. Предварительно установите приложение Fujida Pro для взаимодействия с устройством."
"Что такое «Разрешение камеры»?","Устройства способны вести запись видео при нескольких разрешениях: Ultra HD 3840×2160 (30 к/с), Quad HD 2560×1440 (30 к/с), Super HD 2304×1296 (30 к/с), Full HD 1920×1080 (60 к/с), Full HD 1920×1080 (30 к/с), HD 1280×720. Набор разрешений зависит от модели устройства."
"Что такое «Распознавание знаков (AI Function)»?","Распознавание знаков (AI Function) представляет собой интеллектуальную функцию, встроенную в некоторые современные устройства. Эта технология позволяет автоматически обнаруживать и распознавать дорожные знаки ограничения скорости и выводить информацию на экран устройства. Принцип работы: 1) видеоизображение разбивается на кадры; 2) алгоритмы находят знак; 3) выполняется классификация типа знака; 4) определяется значение и выводится на экран. Особенности: система активируется при движении свыше 80 км/ч. Настройки оповещений: «Голос+картинка» (по умолчанию) или «Только картинка». Функция помогает водителям соблюдать скоростной режим."
"Что такое «Цикл записи»?","Вы можете выбрать длительность записываемых видеороликов 1/2/3 (1/3/5) минуты. Длительность записи видеороликов зависит от модели устройства."
"Что такое «Ночной режим»?","Функция, которая позволяет улучшить качество видеозаписи в условиях низкой освещенности или в темное время суток. Основная особенность — понижение экспозиции на -2 единицы, чтобы избежать пересвета и сохранить детали в темных областях. Потеря яркости компенсируется функцией WDR. Время действия ночного режима можно задать в промежутке с 00:00 до 00:00. Установленное значение по умолчанию: ВЫКЛ."
"Что такое «G-сенсор»?","Датчик столкновения или удара, при срабатывании которого файл будет автоматически блокирован от перезаписи. Доступны варианты настройки: ВЫКЛ / Низкий / Средний / Высокий. Блокировка файла возможна и вручную — кнопкой на корпусе устройства."
"Что такое «WDR»?","Динамический режим видеосъемки, при котором в ярких и темных местах можно получить улучшенное качество видео по сравнению с обычной записью. Установленное значение по умолчанию: ВКЛ."
"Что такое «Задержка включения»?","Позволяет задать время задержки включения, чтобы регистратор не включался сразу при подаче питания. Это защищает от скачка напряжения при запуске двигателя. Варианты: ВЫКЛ / 10 сек / 20 сек / 30 сек. Установленное значение по умолчанию: ВЫКЛ."
"Что такое «Спидометр и Часы»?","При включении во время движения на дисплее отображается текущая скорость автомобиля, во время остановки — часы. Установленное значение по умолчанию: ВКЛ."
"Что такое «Автоотключение экрана»?","Функция перехода устройства в режим заставки: вместо изображения записи выводится черный фон, остаются спидометр, часы и индикатор записи. Варианты: ВЫКЛ / 10 сек / 20 сек / 30 сек. Установленное значение по умолчанию: 30 сек."
"Что такое «Датчик движения»?","Функция записи только при наличии движения в кадре. Не рекомендуется использовать во время движения автомобиля, иначе может нарушиться цикличность записи. Установленное значение по умолчанию: ВЫКЛ."
