question,answer
"При втором повороте ключа видеорегистратор перестаёт работать и выключается.; Почему Fujida отключается когда завожу машину.; Регистратор работает пока не поверну ключ зажигания до конца.; Karma выключается в момент запуска двигателя автомобиля.; При старте мотора видеорегистратор гаснет и перезагружается что делать.","Правильное включение авто: самое правильное включение автомобиля — это первый поворот ключа до момента, когда срабатывает бензонасос. В этот момент подаётся питание, конденсатор комбо набирает заряд, и процессор начинает следить за питанием. Дальнейшие действия: после первого поворота ключа заводите автомобиль. В зависимости от машины, комбо может либо перезагрузиться, либо продолжить свою работу. Особенности автозапуска: в некоторых автомобилях при автозапуске прикуриватель не работает, пока не повернёте ключ в замке зажигания. Это зависит от особенностей автомобиля. Рекомендации по эксплуатации: лучше уносить комбо с собой, особенно при низких температурах, так как на устройстве может собираться конденсат, который пагубно влияет на его работу. Практическое наблюдение: если бережно относиться к устройству, оно проработает долго и надёжно."
"Камеру проехал, а комбо всё ещё оповещает по радиомодулю.; Почему Karma продолжает сигналить о камере которую я уже миновал.; Радар-детектор пищит даже после того как я проехал пост контроля скорости.; В чем причина ложных срабатываний радара после проезда камеры.; Устройство долго не прекращает оповещение по радиомодулю даже когда камера позади.","Направление камер: в городах с большим количеством камер может быть ситуация, когда камеры направлены как в лоб, так и в спину. Это увеличивает вероятность того, что устройство продолжает улавливать сигнал. Дальность улавливания: некоторые камеры могут быть замечены комбо на расстоянии более километра. Даже если вы проехали камеру, устройство продолжает оповещать, пока полностью не потеряет сигнал. Индикация: пока устройство не зафиксирует, что сигнал камеры полностью исчез, на экране будет отображаться соответствующая индикация."
"Зачем нужна задержка включения.; Для чего в настройках Karma есть функция отложенного старта.; Какие преимущества дает установка таймера на включение регистратора.; Почему устройство не включается сразу при подаче питания можно ли это изменить.; В каких ситуациях полезна функция задержки запуска комбо-устройства.; Почему при запуске двигателя устройство перезагружается.; Видеорегистратор Fujida отключается когда завожу машину.; При повороте ключа зажигания Karma выключается и снова включается.; Регистратор перезагружается в момент старта двигателя это нормально.; Как предотвратить выключение комбо-устройства при запуске мотора автомобиля.","При запуске двигателя автомобиля напряжение может кратковременно падать из-за работы стартера. Если напряжение на аккумуляторе падает ниже 12.4 В, видеорегистратор может автоматически перезагрузиться. Чтобы избежать сбоя работы устройства в момент падения напряжения, предусмотрена задержка включения. Это позволяет устройству продолжать работать при запуске двигателя. Когда вы заводите машину, напряжение падает, но устройство не выключается сразу, а проходит небольшой период на заставке, чтобы избежать перезагрузки. После восстановления нормального напряжения устройство продолжает свою работу. Если напряжение не опускается ниже 12.4 В, перезагрузки не происходит."
"Как работает парковочный режим у устройств с дополнительной камерой, почему изображение становится зеркальным.; Для чего Fujida Duo переворачивает картинку с задней камеры при парковке.; В каких случаях видео с дополнительной камеры отображается в зеркальном виде.; Почему задняя камера на моем регистраторе показывает все наоборот при парковке.","Автоматическое включение камеры заднего вида: при включении парковочного режима камера заднего вида активируется автоматически. На экране отображаются парковочные полосы, которые помогают водителю при парковке. Зеркальное изображение: изображение с камеры отображается в зеркальном виде. Это не является дефектом, а наоборот, правильной работой устройства. Цель зеркального изображения: зеркальное изображение создано для того, чтобы облегчить восприятие водителем ситуации при движении задним ходом, что позволяет более точно ориентироваться при парковке."
"Не воспроизводятся видео на телефоне.; Не воспроизводятся видео на телефоне из приложения Fujida.Pro.; Ролики с регистратора не открываются в мобильном приложении.; Почему я не могу просмотреть записи с Karma на своем смартфоне.; Приложение зависает при попытке воспроизвести видео с видеорегистратора.; При нажатии на файл записи в телефоне ничего не происходит.; Не воспроизводятся видео на компьютере.; Файлы записи с Fujida не открываются на ПК какой кодек нужен.; Компьютер не видит видеофайлы с SD карты Karma.; При попытке просмотра роликов с регистратора на компьютере появляется ошибка.; Какой программой лучше всего просматривать видео с видеорегистратора на Windows.","Установите VLC media player или другой плеер с последними драйверами для полноценного просмотра видеофайлов."
"Ссылки на видео обучение для обновления устройств и проверки карты памяти.; Где посмотреть видео инструкцию по обновлению Fujida.; Пришлите ссылки на обучающие видео о проверке SD карты для регистратора.; Есть ли на YouTube канал с официальными туториалами по настройке видеорегистраторов.; Хочу посмотреть как правильно обновлять прошивку Karma видеоурок.; Скиньте обучающее видео как диагностировать проблемы с картой памяти.","Как обновить комбо-устройство Fujida через мобильное приложение на IOS: Ссылка на видео. Как обновить комбо-устройство Fujida с помощью компьютера и карты памяти: Ссылка на видео. Как проверить карту памяти на скорость и работоспособность: Ссылка на видео. Как обновить комбо-устройство Fujida через мобильное приложение на Android: Ссылка на видео."
"Как настроить оповещение радар-детектора у комбо-устройств 3в1.; Где в меню Karma изменить громкость и тип оповещения о камерах.; Как отключить звуковой сигнал для определенных типов радаров.; Можно ли настроить дальность срабатывания радар-детектора в Fujida.; Какие параметры оповещений можно регулировать в комбо-устройстве.","Оповещения на переносные камеры происходят способом появления диапазона К (выделение частоты из всего диапазона при работе сигнатуры) и эффекта Гейгера, а также звуковым сигналом. Если вы хотите, чтобы он оповещал о камерах голосом, то необходимо включить Смарт-режим и отключить диапазон К только если в вашем городе нет камер Арена. В таком случае радар-детектор будет работать по сигнатуре и оповещать голосом о типе переносных камер. Также в настройках радар-детектора есть функция фильтра скорости. При активной функции радар-детектор не будет оповещать вас о камерах звуковыми оповещениями, если вы не превышаете ограничения скорости данной камеры, а только отобразит информацию на экране регистратора визуально. Отключить или включить эту функцию можно в настройках радар-детектора, нажав кнопку rd. По умолчанию она включена. Также обратите внимание на функцию Тихий режим, при котором радар отключается при скорости ниже заданного лимита, и функцию фильтр слабых сигналов — радар не оповещает о камерах, пока сила сигнала гейгер-эффекта не достигнет определённого значения."
"Видеорегистратор показывает 00000000 или 00002000, что делать.; На дисплее Fujida вместо нормальной информации одни нули это поломка.; После сброса настроек экран регистратора отображает только цифры 00000000.; Почему на Karma появились странные цифры 00002000 вместо даты и времени.; Как исправить ошибку когда на дисплее комбо-устройства только нули.","Если в меню устройства пункт База камер отображается 00000000, необходимо проверить карту памяти на исправность с помощью приложения на компьютере. Если она неисправна или не соответствует 10 классу, то все функции устройства могут работать некорректно. Убедитесь в том, что в слот устройства карта памяти установлена корректно. Также возможно, что есть проблемы с GPS-креплением. Если это отображается в меню версии прошивки или радар-детектора (относится только к комбо-устройствам 3в1), необходимо проверить карту памяти на исправность с помощью приложения на компьютере. Если она неисправна или не соответствует 10 классу, то все функции устройства могут работать некорректно. Также вероятно, что антенна вышла из строя. Если версия ПО видеорегистратора показывает некорректные данные, устройство следует обновить с помощью карты памяти. Если при обновлении шкала на экране устройства зависла, необходимо обратиться в сервисный центр."
"Как к Вам подъехать?; Где находится ближайший сервисный центр Fujida.; Подскажите адрес офиса для сдачи видеорегистратора в ремонт.; Можно ли лично привезти устройство Karma в сервис центр.; На какой адрес доставить регистратор для гарантийного обслуживания.","Мы работаем как интернет-магазин дистанционным способом. Для того чтобы обратиться в техническую поддержку или сервисный центр, напишите на электронную почту support@fujida.su или свяжитесь через WhatsApp/Telegram: +7 927 035-55-55. Опишите проблему с устройством, укажите модель и приложите фотографии неисправности."
"Черный экран, экран светится чёрным.; Экран светится черным на регистраторе Fujida.; Включаю видеорегистратор но изображения нет только темный дисплей.; Karma работает но на экране ничего не видно только подсветка.; Дисплей устройства включен однако показывает только черный цвет.; После обновления на комбо-устройстве пропало изображение только черный экран.","Отключите функцию Автовыключение экрана. Если экран вовсе не подсвечивается, то рекомендуем обратиться в сервисный центр."
"Где купить видеорегистратор, ссылка на магазин яндекс маркет, ссылка на магазин озон, ссылка на магазин вб, ссылка на магазин валдберрис, ссылка на магазин вайлдберис, ссылка на магазин Ozon, ссылка на магазин Wildberries, ссылка на магазин Яндекс Маркет","Приобрести видеорегистраторы, радар-детекторы, комбо-устройства и карты памяти Fujida можно на следующих площадках: Ozon: https://ozon.ru/t/cBqPhgj Wildberries: https://www.wildberries.ru/seller/1184874 Яндекс Маркет: https://market.yandex.ru/business--fujida-official-store/10308730?utm_medium=sharing Официальный сайт Fujida: https://fujida.pro/"
"Здравствуйте покупал Fujida boom biik s На экране показывает радар, но не говорит а звук включён в чем может быть дело?","Отсутствие звуковых оповещений на Fujida Boom Blik S при включенном звуке чаще всего связано с настройкой Фильтр скорости. Убедитесь, что эта функция не активирована или установлена на комфортное для вас значение (например, 0 км/ч, если хотите слышать все оповещения). Устройство Fujida Boom Blik S не имеет функций Тихий режим или отдельных настроек режима, влияющих на голосовые оповещения, кроме общей громкости и фильтра скорости. Если проверка настройки Фильтр скорости не помогла, обратитесь в службу поддержки: по электронной почте support@fujida.su или через WhatsApp/Telegram: +7 927 035-55-55."
"Как прибавить звук на hit s?","На устройстве Fujida Zoom Hit S WiFi громкость регулируется кнопкой «Стрелка вниз» во время работы устройства (не в меню)."
"На видеорегистраторе при включении появляется жёлтое окошко с сообщением ""menuseting is invalid, menuseting will recover, The device reboot!!!!!!!"" и отключается. При повторном включении всё повторяется.","Для решения проблемы с сообщением menuseting is invalid, menuseting will recover, The device reboot на вашем видеорегистраторе, рекомендуется обновить прошивку. Пожалуйста, выполните следующие шаги: Перейдите по ссылке: https://update.fujida.su/services/ Выберите вашу модель устройства и скачайте файл с Актуальной прошивкой и базой камер. Извлеките файлы из скачанного архива. Отформатируйте карту памяти microSD на самом устройстве (если такой опции нет или карта >32GB, то на компьютере в FAT32, кластер 32КБ). Перенесите разархивированные файлы прошивки (обычно это один файл с расширением .bin или несколько файлов) в корневую директорию карты памяти. Вставьте карту памяти с файлами в слот выключенного видеорегистратора. Подключите видеорегистратор к питанию с помощью оригинального кабеля, идущего в комплекте. Устройство должно включиться автоматически. На экране будет отображаться статус обновления прошивки (обычно в процентах). Не отключайте питание во время обновления! По завершении процесса устройство автоматически перезагрузится. Файлы прошивки с карты памяти могут удалиться автоматически. После перезагрузки проверьте в меню настроек версию прошивки. Если проблема повторится после обновления, обратитесь в сервисный центр Fujida."
"Как настроить время","Способ настройки времени на устройствах Fujida зависит от наличия GPS-модуля: Если у вашего устройства есть GPS-модуль: время обычно синхронизируется автоматически по спутникам. Вам нужно только установить правильный часовой пояс в меню видеорегистратора (Настройки -> Часовой пояс). По умолчанию часто установлено Московское время (GMT+03:00). Если устройство поддерживает подключение к мобильному приложению, время также может установиться автоматически при синхронизации с телефоном. Если у вашего устройства нет GPS-модуля: зайдите в меню видеорегистратора, найдите пункт Дата и время (или аналогичный) и установите текущие значения вручную."
"Не ловит GPS","Если ваш видеорегистратор Fujida не ловит GPS, попробуйте следующие шаги для диагностики и устранения проблемы: Проверьте возможную блокировку сигнала: в некоторых регионах, особенно вблизи стратегических объектов, могут использоваться системы РЭБ, подавляющие GPS-сигнал. Попробуйте проверить работу GPS в другом месте, например, за городом. Если иконка спутника на экране станет активной (обычно белого цвета) или начнет отображаться скорость, значит, соединение установлено. Проверьте карту памяти: неисправная или медленная карта памяти (ниже 10 класса скорости) может влиять на корректную работу всех функций устройства, включая GPS. Проверить карту памяти на скорость и работоспособность можно с помощью программы HD_Speed. Скачать: https://www.fujida.su/guarantee/microSD-test.php?clear_cache=Y Видеоинструкция по проверке карты памяти: https://vkvideo.ru/video-174258496_456239177 Если скорость записи ниже 10 МБ/с, карту необходимо заменить. Проверьте версию базы камер (косвенный признак работы GPS-модуля): зайдите в меню настроек устройства и посмотрите информацию о версии базы камер. Если она отображается как 00000000 или подобным образом, это может указывать на неисправность GPS-модуля. Прошивка: убедитесь, что на устройстве установлена актуальная прошивка. Если после этих шагов проблема не решена, обратитесь в службу поддержки."
